<?xml version="1.0" encoding="UTF-8"?><xs:schema xmlns:xs="http://www.w3.org/2001/XMLSchema" xmlns="http://www.xml-sicherheit.de" targetNamespace="http://www.xml-sicherheit.de" xml:lang="en">	<xs:import namespace="http://www.w3.org/XML/1998/namespace" schemaLocation="http://www.w3.org/2001/xml.xsd"/>	<xs:annotation>		<xs:documentation xml:lang="en">			XML-Security Plug-in documentation schema. Used for online help and tutorials.		</xs:documentation>	</xs:annotation>	<xs:element name="title" type="xs:string"/>	<xs:element name="strong" type="xs:string"/>	<xs:element name="keyword" type="xs:string"/>	<xs:element name="definition" type="xs:string"/>	<xs:element name="description" type="xs:string"/>	<xs:element name="headline">		<xs:complexType>			<xs:simpleContent>				<xs:extension base="xs:string">					<xs:attribute name="id" type="xs:ID" use="required"/>				</xs:extension>			</xs:simpleContent>		</xs:complexType>	</xs:element>	<xs:element name="data">		<xs:complexType mixed="true">			<xs:sequence>				<xs:element ref="strong" minOccurs="0" maxOccurs="unbounded"/>				<xs:element ref="keyword" minOccurs="0" maxOccurs="unbounded"/>			</xs:sequence>		</xs:complexType>	</xs:element>	<xs:element name="acronyms">		<xs:complexType>			<xs:sequence>				<xs:element ref="acronym" maxOccurs="unbounded"/>			</xs:sequence>		</xs:complexType>	</xs:element>	<xs:element name="acronym">		<xs:complexType>			<xs:sequence>				<xs:element ref="definition"/>				<xs:element ref="description"/>			</xs:sequence>			<xs:attribute name="abbreviation" type="xs:ID" use="required"/>		</xs:complexType>	</xs:element>	<xs:element name="chapter">		<xs:complexType>			<xs:sequence>				<xs:element ref="title" minOccurs="0"/>				<xs:element ref="text"/>			</xs:sequence>			<xs:attribute name="category" use="required">				<xs:simpleType>					<xs:restriction base="xs:string">						<xs:enumeration value="general"/>						<xs:enumeration value="basics"/>						<xs:enumeration value="plugin"/>						<xs:enumeration value="resources"/>					</xs:restriction>				</xs:simpleType>			</xs:attribute>			<xs:attribute ref="xml:lang" use="required"/>			<xs:attribute ref="xml:id" use="required"/>		</xs:complexType>	</xs:element>	<xs:element name="text">		<xs:complexType>			<xs:choice minOccurs="0" maxOccurs="unbounded">				<xs:element ref="p"/>				<xs:element ref="list"/>				<xs:element ref="code"/>				<xs:element ref="table"/>				<xs:element ref="headline"/>				<xs:element ref="link"/>				<xs:element ref="image"/>				<xs:element ref="resources" minOccurs="0"/>				<xs:element ref="acronyms" minOccurs="0"/>			</xs:choice>		</xs:complexType>	</xs:element>	<xs:element name="p">		<xs:complexType mixed="true">			<xs:choice minOccurs="0" maxOccurs="unbounded">				<xs:element ref="strong"/>				<xs:element ref="keyword"/>				<xs:element ref="link"/>				<xs:element ref="eclipse"/>			</xs:choice>			<xs:attribute name="id" type="xs:ID" use="optional"/>		</xs:complexType>	</xs:element>	<xs:element name="list">		<xs:complexType>			<xs:choice maxOccurs="unbounded">				<xs:element ref="point"/>				<xs:element ref="list"/>			</xs:choice>			<xs:attribute name="type" use="required">				<xs:simpleType>					<xs:restriction base="xs:string">						<xs:enumeration value="ordered"/>						<xs:enumeration value="unordered"/>					</xs:restriction>				</xs:simpleType>			</xs:attribute>		</xs:complexType>	</xs:element>	<xs:element name="point">		<xs:complexType mixed="true">			<xs:choice minOccurs="0" maxOccurs="unbounded">				<xs:element ref="strong"/>				<xs:element ref="keyword"/>				<xs:element ref="link"/>			</xs:choice>		</xs:complexType>	</xs:element>	<xs:element name="link">		<xs:complexType mixed="true">			<xs:sequence>				<xs:element ref="image" minOccurs="0"/>			</xs:sequence>			<xs:attribute name="id" type="xs:anyURI" use="required"/>		</xs:complexType>	</xs:element>	<xs:element name="image">		<xs:complexType>			<xs:attribute name="id" type="xs:anyURI" use="required"/>			<xs:attribute name="title" type="xs:string" use="required"/>			<xs:attribute name="width" use="required">				<xs:simpleType>					<xs:restriction base="xs:positiveInteger">						<xs:minInclusive value="1"/>						<xs:maxInclusive value="800"/>					</xs:restriction>				</xs:simpleType>			</xs:attribute>			<xs:attribute name="height" use="required">				<xs:simpleType>					<xs:restriction base="xs:positiveInteger">						<xs:minInclusive value="1"/>						<xs:maxInclusive value="800"/>					</xs:restriction>				</xs:simpleType>			</xs:attribute>		</xs:complexType>	</xs:element>	<xs:element name="table">		<xs:complexType>			<xs:sequence>				<xs:element ref="head"/>				<xs:element ref="row" maxOccurs="unbounded"/>			</xs:sequence>			<xs:attribute name="width" type="xs:positiveInteger" use="optional"/>			<xs:attribute name="border" type="xs:positiveInteger" use="optional"/>		</xs:complexType>	</xs:element>	<xs:element name="head">		<xs:complexType>			<xs:sequence>				<xs:element ref="data" maxOccurs="unbounded"/>			</xs:sequence>		</xs:complexType>	</xs:element>	<xs:element name="row">		<xs:complexType>			<xs:sequence>				<xs:element ref="data" maxOccurs="unbounded"/>			</xs:sequence>			<xs:attribute name="valign" type="xs:string" use="optional"/>		</xs:complexType>	</xs:element>	<xs:element name="resources">		<xs:complexType>			<xs:sequence>				<xs:element ref="title"/>				<xs:element ref="link" maxOccurs="unbounded"/>			</xs:sequence>		</xs:complexType>	</xs:element>	<xs:element name="code">		<xs:complexType mixed="true">			<xs:choice minOccurs="0" maxOccurs="unbounded">				<xs:element ref="link"/>			</xs:choice>		</xs:complexType>	</xs:element></xs:schema>