<?xml version="1.0" encoding="UTF-8"?>
<?xml-stylesheet type="text/xsl" href="../resources/stylesheet.xsl"?>
<chapter category="general" xmlns="http://www.xml-sicherheit.de" xmlns:xsi="http://www.w3.org/2001/XMLSchema-instance" xml:id="intro" xml:lang="de" xsi:schemaLocation="http://www.xml-sicherheit.de ../resources/documentation.xsd">
	<text>
		<p>Dieses Tutorial ist Bestandteil des <strong>XML-Security Plug-In</strong>, dem Open Source eLearning Plug-in für XML-Sicherheit mit Eclipse ab Version 3.0. Mit dem XML-Security Plug-In können Sie beliebige XML-Dokumente sichern und <keyword>XML Canonicalization</keyword>, <keyword>XML Digitale Signaturen</keyword> sowie <keyword>XML Verschlüsselung</keyword> in beliebigen XML-Dokumenten ausprobieren und anwenden. Verschiedene Cheat Sheets erleichtern Einsteigern die ersten Schritte mit dem Plug-in und der XML-Sicherheit. Die umfangreiche Online-Hilfe des Plug-ins enthält ausführliche Informationen zu den W3C Empfehlungen und Hintergründe zu den digitalen Signaturen und der Verschlüsselung mit der Extensible Markup Language sowie Erläuterungen zur Verwendung des XML-Security Plug-Ins.</p>
		<p>Im Vordergrund des XML-Security Plug-Ins stehen die praktische Anwendung und das Experimentieren mit den vielfältigen Möglichkeiten der XML-Sicherheit: beliebige XML-Dokumente können kanonisiert, digital signiert, verifiziert sowie ver- und entschlüsselt werden. Die theoretischen Kenntnisse und Hintergründe zu den umfangreichen W3C Empfehlungen stehen in der ausführlichen Online-Hilfe und diesen Tutorials verständlich zum Nachlesen bereit.</p>
		<p>Für das XML-Security Plug-In sind Kenntnisse in <keyword>XML</keyword> erforderlich, <keyword>XPath Expressions</keyword> und <keyword>Namespaces</keyword> sind hilfreich aber nicht zwingend notwendig. Empfehlenswert sind außerdem Kenntnisse in <keyword>XML Schema (XSD)</keyword>, <keyword>Document Type Definition (DTD)</keyword> und <keyword>XSL Transformations (XSLT)</keyword>. Kenntnisse in der <keyword>Kryptografie</keyword> (Digitale Signaturen, Verschlüsselung, Hashfunktionen) sind hilfreich aber nicht unbedingt erforderlich. Für das XML-Security Plug-In sollten dafür grundlegende <keyword>Eclipse</keyword> Kenntnisse vorhanden sein.</p>
		<p>Die Homepage zum <strong>XML-Security Plug-In</strong> und zur <strong>XML-Sicherheit</strong> für Support, Tipps, Update Site und vielem mehr ist verfügbar unter <link id="http://www.xml-sicherheit.de/">http://www.xml-sicherheit.de</link>. Der Source Code des Plug-ins findet sich auf der SourceForge Projektseite unter <link id="http://sourceforge.net/projects/xml-security">http://sourceforge.net/projects/xml-security</link>.</p>
		<p>Das <strong>XML-Security Plug-In</strong> steht unter der <keyword>Eclipse Public License Version 1.0</keyword>, einsehbar unter <link id="http://www.eclipse.org/legal/epl-v10.html">http://www.eclipse.org/legal/epl-v10.html</link>. Die für das XML-Security Plug-in notwendige Apache XML Security API (<keyword>Santuario</keyword>) im Plug-in <strong>org.apache.xml.security</strong> sowie Apache Xalan im Plug-in <strong>org.apache.xalan</strong> stehen unter der <keyword>Apache Software License Version 2.0</keyword>. Diese ist einsehbar unter <link id="http://www.apache.org/licenses/LICENSE-2.0.html">http://www.apache.org/licenses/LICENSE-2.0.html</link>.</p>
		<p>Seit Oktober 2008 ist das XML-Security Plug-In ein offizielles Eclipse Plug-in und wird nicht mehr eigenständig weiterentwickelt. Unter dem Namen <strong>XML Security Tools</strong> sind neue Versionen des Plug-ins nun im Incubator der <link id="http://www.eclipse.org/webtools/incubator/">Eclipse Web Tools Platform (WTP)</link> zu finden.</p>
		<p>Fehler im Tutorial? Unverständliche oder unvollständige Erklärung? Mehr Informationen gewünscht? Den Entwickler und Autor Dominik Schadow erreichen Sie per Email über <link id="mailto:info@xml-sicherheit.de">info@xml-sicherheit.de</link> oder über die zahlreichen Kontaktmöglichkeiten auf der Homepage.</p>
	</text>
</chapter>
