<?xml version="1.0" encoding="UTF-8"?><?xml-stylesheet type="text/xsl" href="../resources/stylesheet.xsl"?><chapter category="general" xmlns="http://www.xml-sicherheit.de" xmlns:xsi="http://www.w3.org/2001/XMLSchema-instance" xml:id="overview" xml:lang="de" xsi:schemaLocation="http://www.xml-sicherheit.de ../resources/documentation.xsd">	<title>Übersicht</title>	<text>		<p>Der XML Security Guide besteht aus den beiden Teilen <link id="basics/xml-security.html">XML-Security Basics</link> und <link id="plugin/plugin.html">XML-Security Plug-In</link>. Im theoretischen ersten Teil finden Sie ausführliche und verständliche Informationen über die Empfehlungen des World Wide Web Consortiums (W3C) zu den digitalen Signaturen (<keyword>XML Digital Signatures</keyword>) und der Verschlüsselung (<keyword>XML Encryption</keyword>) mit XML, zum Basic Security Profile (BSP) und anderen verwandten Themen wie der Kanonisierung (<keyword>XML Canonicalization</keyword>). Kenntnisse in diesen Themen sind Vorraussetzung um effektiv mit dem XML-Security Plug-In arbeiten zu können. Im praktischen zweiten Teil des Guides erhalten Sie umfassende und verständliche Anleitungen zur Verwendung des XML-Security Plug-Ins.</p>		<p>Weiterführende Informationen und Grundlagen zu XML und der Kryptografie finden Sie unter <link id="literature.html">Literatur</link> und <link id="resources.html">Ressourcen</link>. Im <link id="glossary.html">Glossar</link> finden Sie wichtige Abkürzungen aus dem Bereich der XML-Sicherheit und eine kurze Beschreibung.</p>	</text></chapter>