<?xml version="1.0" encoding="UTF-8"?><?xml-stylesheet type="text/xsl" href="../resources/stylesheet.xsl"?><chapter category="general" xmlns="http://www.xml-sicherheit.de" xmlns:xsi="http://www.w3.org/2001/XMLSchema-instance" xml:id="glossary" xml:lang="de" xsi:schemaLocation="http://www.xml-sicherheit.de ../resources/documentation.xsd">	<title>Glossar</title>	<text>		<acronyms>			<acronym abbreviation="AES">				<definition>Advanced Encryption Standard</definition>				<description>Blockchiffre mit variabler Schlüssellänge von 128, 192 oder 256 Bit. 2001 vom NIST zum DES Nachfolger bestimmt</description>			</acronym>			<acronym abbreviation="ASN.1">				<definition>Abstract Syntax Notation One</definition>				<description>Notationsart für die Beschreibung von abstrakten Datentypen und Werten</description>			</acronym>			<acronym abbreviation="BSP">				<definition>Basic Security Profile</definition>				<description>Herstellerunabhängige Empfehlung mit dem Ziel maximaler Interoperabilität und einfachem Datenaustausch</description>			</acronym>			<acronym abbreviation="CBC">				<definition>Cipher Block Chaining</definition>				<description>Symmetrische Blockchiffre - der folgende Block wird mit dem vorherigen verknüpft, erster Block beliebig</description>			</acronym>			<acronym abbreviation="CEK">				<definition>Content Encryption Key</definition>				<description>Verschlüsselt die Nutzdaten einer Kommunikation - aus Geschwindigkeitsgründen meist symmetrische Schlüssel</description>			</acronym>			<acronym abbreviation="CFB">				<definition>Cipher Feedback</definition>				<description>Symmetrische Blockchiffre - Pseudozufallsgenerator zur Erzeugung einer Schlüsselfolge</description>			</acronym>			<acronym abbreviation="CSP">				<definition>Cryptographic Service Provider</definition>				<description>Stellt kryptografische Funktionalität bereit</description>			</acronym>			<acronym abbreviation="DES">				<definition>Data Encryption Standard</definition>				<description>Mittlerweile als unsicher (zu geringe Schlüssellänge) betrachteter symmetrischer Algorithmus</description>			</acronym>			<acronym abbreviation="DES-EDE">				<definition>Data Encryption Standard-Encryption Decryption Encryption</definition>				<description>Verbesserter DES Algorithmus durch längeren Schlüssel (auch Triple DES genannt)</description>			</acronym>			<acronym abbreviation="DH">				<definition>Diffie-Hellman</definition>				<description>1976 als erstes Public-Key-Verfahren vorgestellt, basiert auf dem ElGamal Algorithmus</description>			</acronym>			<acronym abbreviation="DSA">				<definition>Digital Signature Algorithm</definition>				<description>Reiner Signaturalgorithmus vom NIST und der NSA 1991 entwickelt</description>			</acronym>			<acronym abbreviation="DSS">				<definition>Digital Signature Standard</definition>				<description>Spezifiziert den Digital Signature Algorithm (DSA)</description>			</acronym>			<acronym abbreviation="DTD">				<definition>Document Type Definition</definition>				<description>Formale Sprache (nicht in XML-Syntax) zur Festlegung der Struktur eines XML-Dokuments</description>			</acronym>			<acronym abbreviation="ECB">				<definition>Electronic Code Book</definition>				<description>Symmetrische Blockchiffre - jeder Block Text wird separat verschlüsselt, gleicher Text mit gleichem Schlüssel gibt gleiche Chiffre</description>			</acronym>			<acronym abbreviation="IDEA">				<definition>International Data Encryption Algorithm</definition>				<description>1990 veröffentlichter, patentierter, symmetrischer Blockverschlüsselungsalgorithmus</description>			</acronym>			<acronym abbreviation="IETF">				<definition>Internet Engineering Task Force</definition>				<description>Internationale Vereinigung zur Erarbeitung von Standardisierungsvorschlägen für das Internet</description>			</acronym>			<acronym abbreviation="KEK">				<definition>Key Encryption Key</definition>				<description>Verschlüsselt (symmetrisch und asymmetrisch) nur den Schlüssel (CEK) und keine Nutzdaten</description>			</acronym>			<acronym abbreviation="MD2-MD5">				<definition>Message Digest</definition>				<description>Von Ron Rivest entwickelte Hashfunktionen - aktuell MD5, sehr weit verbreitet (Schwächen bekannt)</description>			</acronym>			<acronym abbreviation="MIME">				<definition>Multipurpose Internet Mail Extensions</definition>				<description>Kodierungsstandard zur Festlegung der Struktur und des Aufbaus von Emails und anderen Internetnachrichten</description>			</acronym>			<acronym abbreviation="NIST">				<definition>National Institute of Standards and Technology</definition>				<description>US Behörde für technologische Standardisierungsprozesse</description>			</acronym>			<acronym abbreviation="OASIS">				<definition>Organisation for the Advancement of Structured Information Standards</definition>				<description>Internationales Standardisierungsgremium zur Weiterentwicklung von E-Business- und Web Service Standards</description>			</acronym>			<acronym abbreviation="OCSP">				<definition>Online Certificate Status Protocol</definition>				<description>Internetprotokoll mit dem Clients den Status von X.509 Zertifikaten abfragen können</description>			</acronym>			<acronym abbreviation="OFB">				<definition>Output Feedback</definition>				<description>Symmetrische Blockchiffre - Pseudozufallsgenerator zur Erzeugung einer Schlüsselfolge</description>			</acronym>			<acronym abbreviation="PBE">				<definition>Password-based Encryption</definition>				<description>Der Schlüssel wird aus einem Kennwort generiert</description>			</acronym>			<acronym abbreviation="PCBC">				<definition>Propagating Cipher Block Chaining</definition>				<description>Symmetrische Blockchiffre ähnlich CBC - der vorige Klartextblock und der vorige Chiffretextblock werden mit dem aktuellen Klartextblock XOR-verknüpft</description>			</acronym>			<acronym abbreviation="PKI">				<definition>Public Key Infrastructure</definition>				<description>Infrastruktur zur Verteilung öffentlicher Schlüssel</description>			</acronym>			<acronym abbreviation="RC2-RC6">				<definition>Rons Cipher</definition>				<description>Verschlüsselungsalgorithmus mit variabler Schlüssellänge, erste Version 1989 von Ron Rivest - aktuell RC6, Vorversionen als unsicher betrachtet (bzw. gebrochen)</description>			</acronym>			<acronym abbreviation="RSA">				<definition>Rivest, Shamir, Adleman</definition>				<description>1977 von Rivest, Shamir und Adleman vorgestellter Algorithmus - bekannt vor allem durch die Verwendung in PGP zur asymmetrischen Verschlüsselung</description>			</acronym>			<acronym abbreviation="SAML">				<definition>Security Assertion Markup Language</definition>				<description>XML-basierte Spezifikation zur Definition von sicherheitsrelevanten Informationen zur Authentifizierung, Autorisierung und Anwender-Attributen sowie Berechtigungs-Schemata</description>			</acronym>			<acronym abbreviation="SHA">				<definition>Secure Hash Algorithm</definition>				<description>Speziell zum Signieren entwickelter Hashalgorithmus mit einem 160 Bit langen Hashwert für DSS</description>			</acronym>			<acronym abbreviation="SOAP">				<definition>ursprünglich: Simple Object Access Protocol</definition>				<description>Protokoll zum Übermittlung von XML-Nachrichten, SOAP ist seit Version 1.2 kein Akronym mehr</description>			</acronym>			<acronym abbreviation="URI">				<definition>Uniform Resource Identifier</definition>				<description>Zeichenfolge zur Identifizierung einer abstrakten oder physikalischen Ressource</description>			</acronym>			<acronym abbreviation="W3C">				<definition>World Wide Web Consortium</definition>				<description>Gremium zur Standardisierung von Techniken rund um das World Wide Web</description>			</acronym>			<acronym abbreviation="WSS">				<definition>Web Service Security (auch WS-Security)</definition>				<description>Umfangreiche Empfehlungen rund um die Sicherheit von Web Services</description>			</acronym>			<acronym abbreviation="XAdES">				<definition>XML Advanced Electronic Signatures</definition>				<description>Ergänzung von Cisco mit deren Hilfe die Nicht-Abstreitbarkeit für XML-Signaturen umgesetzt werden kann</description>			</acronym>			<acronym abbreviation="XKMS">				<definition>XML Key Management Specification</definition>				<description>PKI Funktionen basierend auf XML als Beschreibungssprache für den Nachrichtenaustausch der Teilnehmer</description>			</acronym>			<acronym abbreviation="X-KISS">				<definition>XML Key Information Service Specification</definition>				<description>Spezifikation zur Suche und Validierung von öffentlichen Schlüsseln</description>			</acronym>			<acronym abbreviation="X-KRSS">				<definition>XML Key Registration Service Specification</definition>				<description>Spezifikation zur Erstellung, Registrierung und dem Widerruf von Schlüsseln</description>			</acronym>			<acronym abbreviation="XML">				<definition>Extensible Markup Language</definition>				<description>Erweiterbare Metasprache des W3C zur Dokumentenauszeichnung in maschinen- und menschenlesbarer Form</description>			</acronym>		</acronyms>	</text></chapter>