<?xml version="1.0" encoding="UTF-8"?><?xml-stylesheet type="text/xsl" href../../resources/stylesheet.xsl"?><chapter category="resources" xmlns="http://www.xml-sicherheit.de" xmlns:xsi="http://www.w3.org/2001/XMLSchema-instance" xml:id="encryption_resources" xml:lang="de" xsi:schemaLocation="http://www.xml-sicherheit.de ../../resources/documentation.xsd">	<text>		<resources>			<title>Online Resources</title>			<link id="http://www.w3.org/TR/xml-encryption-req">XML Encryption Requirements</link>			<link id="http://www.w3.org/TR/xmlenc-core/xenc-schema.xsd">XML Encryption Schema</link>			<link id="http://www.w3.org/TR/xmlenc-core">XML Encryption Syntax and Processing 1.0</link>            <link id="http://www.w3.org/TR/xmlenc-core1">XML Encryption Syntax and Processing 1.1</link>			<link id="http://www.w3.org/Encryption/2001">XML Encryption Working Group</link>		</resources>	</text></chapter>