<?xml version="1.0" encoding="UTF-8"?><?xml-stylesheet type="text/xsl" href="../../resources/stylesheet.xsl"?><chapter category="plugin" xmlns="http://www.xml-sicherheit.de" xmlns:xsi="http://www.w3.org/2001/XMLSchema-instance" xml:id="sign_page_create_certificate" xml:lang="de" xsi:schemaLocation="http://www.xml-sicherheit.de ../../resources/documentation.xsd">	<title>Create a new Key</title>	<text>		<p>Auf dieser zweiten Seite des <keyword>Digital Signature Wizard</keyword> können Sie einen neuen Schlüssel in einem vorhandenen Java Keystore generieren. Nach Angabe aller erforderlichen Daten wird das Zertifikat unter dem von Ihnen angegebenen <keyword>Alias</keyword> im ausgewählten Keystore gespeichert und zur Generierung dieser digitalen Signatur verwendet.</p>		<image id="../images/dsig-2b.png" title="Create a new Certificate" width="275" height="392"/>		<p>Zunächst müssen Sie die Daten für den <keyword>Distinguished Name</keyword> angeben. Dazu gehören <keyword>Common Name</keyword>, <keyword>Organizational Unit</keyword>, <keyword>Organization</keyword>, <keyword>Location</keyword>, <keyword>State</keyword> und <keyword>Country</keyword>. Lediglich der <keyword>Common Name</keyword> ist ein Pflichtfeld, die anderen fünf sind optional. Während der Eingabe der Daten zeigt das Vorschaufeld eine Übersicht Ihrer getätigten Eingaben an.</p>		<p>Anschließend sind einige Angaben zum Schlüssel (<keyword>Key</keyword>) erforderlich. Der <keyword>Alias</keyword> ist ein Pflichtfeld und muss zwischen 4 und 20 Zeichen lang sein. Das <keyword>Password</keyword> für das Zertifikat ist ebenfalls ein Pflichtfeld und muss mindestens 6, maximal jedoch 20 Zeichen lang sein. Mit dem <strong>Punkt</strong> Button rechts neben den Eingabefeld können Sie sich den Klartext anzeigen lassen und Ihre Eingabe kontrollieren. Aus der <keyword>Type</keyword> Auswahlbox können Sie jetzt noch den Typ des Zertifikats auswählen. Möglich sind <keyword>Digital Signature Algorithm (DSA)</keyword>, <keyword>Elliptic Curve DSA (ECDSA)</keyword> und <keyword>Rivest, Shamir, Adleman (RSA)</keyword>.</p>		<p>Jetzt müssen Sie noch den Java Keystore (mit der Dateiendung <keyword>.jks</keyword>) angeben, den Sie um das neue Zertifikat erweitern wollen. Über den Button <strong>Open...</strong> öffnen Sie das Standarddialogfeld zur Auswahl einer solchen Datei. Damit das Zertifikat darin gespeichert werden kann ist noch die Eingabe des Keystore Passworts im <keyword>Password</keyword> Feld erforderlich. Mit dem <strong>Punkt</strong> Button rechts neben den Eingabefeld können Sie sich den Klartext anzeigen lassen und Ihre Eingabe kontrollieren.</p>		<p>Nach der korrekten Angabe aller erforderlichen Daten können Sie das Zertifikat über den Button <strong>Create Certificate</strong> generieren und im angegebenen Keystore speichern lassen.</p>		<p>Das generierte Zertifikat können Sie in Zukunft über die Seite <link id="sign_page_open_certificate.html">Open an existing Certificate</link> direkt verwenden. Dazu benötigen Sie neben dem Dateinamen die unter <keyword>Certificate Alias</keyword>, <keyword>Certificate Password</keyword> und <keyword>Keystore Password</keyword> angegebenen Daten.</p>		<p>Nach der erfolgreichen Generierung des neuen Zertifikats können Sie mit dem <strong>Next</strong> Button auf die nächste Seite des Digital Signature Wizards wechseln: <link id="sign_page_algorithms.html">Algorithms and Signature Properties</link>.</p>	</text></chapter>