<?xml version="1.0" encoding="UTF-8"?><?xml-stylesheet type="text/xsl" href="../../resources/stylesheet.xsl"?><chapter category="plugin" xmlns="http://www.xml-sicherheit.de" xmlns:xsi="http://www.w3.org/2001/XMLSchema-instance" xml:id="canonicalize" xml:lang="de" xsi:schemaLocation="http://www.xml-sicherheit.de ../../resources/documentation.xsd">	<title>Canonicalization</title>	<text>		<p>Mit den Menüeinträgen <strong>Canonicalization without comments</strong> und <strong>Canonicalization with comments</strong> aus dem Kontextmenü können Sie das gewählte XML-Dokument mit der <keyword>Exclusive XML Canonicalization</keyword> oder <keyword>Inclusive XML Canonicalization</keyword> kanonisieren. Ob die <keyword>exclusive</keyword> oder die <keyword>inclusive</keyword> Variante verwendet wird und ob das XML-Dokument direkt aktualisiert wird oder ein weiteres Editorfenster mit der kanonisierten Version erstellt wird hängt von den Einstellungen in den <link id="prefs.html">Preferences</link> ab. Beim Aufruf über eine View wie den Navigator und der Zieldokument Einstellung <keyword>New Document</keyword> wird das kanonisierte XML-Dokument als <keyword>[Dateiname]_canon.xml</keyword> im aktuellen Projekt gespeichert.</p>		<p>Wenn Sie <strong>Canonicalization without comments</strong> auswählen werden die Kommentare im XML-Dokument entfernt und durch Leerzeilen ersetzt, bei <strong>Canonicalization with comments</strong> bleiben die Kommentare erhalten. In jedem Fall wird der Befehl sofort ausgeführt (ohne Assistent) und das XML-Dokument entweder im Editor aktualisiert oder im Dateisystem gespeichert.</p>		<p>Die Kanonisierung ist an sich ein sehr einfacher Vorgang. Mit der Möglichkeit diese separat auszuführen sollen Ihnen vor allem die Vorgänge bei der Signierung verdeutlicht werden, was sich hinter dem Stichwort <keyword>Kanonisierung</keyword> verbirgt und welche Veränderungen dabei in einem XML-Dokument durchgeführt werden. Die Kanonisierung ist einer der wichtigsten Vorgänge die unter anderem bei der Signierung vor den Blicken des Benutzers verborgen ablaufen.</p>	</text></chapter>