<?xml version="1.0" encoding="UTF-8"?><?xml-stylesheet type="text/xsl" href="../../resources/stylesheet.xsl"?><chapter category="basics" xmlns="http://www.xml-sicherheit.de" xmlns:xsi="http://www.w3.org/2001/XMLSchema-instance" xml:id="encryption_syntax_encryptionmethod" xml:lang="de" xsi:schemaLocation="http://www.xml-sicherheit.de ../../resources/documentation.xsd">	<title>Das EncryptionMethod Element</title>	<text>		<p>Das optionale Element <strong>EncryptionMethod</strong> bestimmt mit dem Attribut <keyword>Algorithm</keyword> den verwendeten Verschlüsselungsalgorithmus und mögliche zugehörige Parameter. Fehlt dieses Element muss dem Empfänger oder der verarbeitenden Applikation der zur Verschlüsselung verwendete Algorithmus bekannt sein.</p>		<p>Zwei der möglichen Kindelemente sind <strong>KeySize</strong> und <strong>OAEPparams</strong> die den verwendeten Algorithmus durch Angabe der Schlüssellänge und weiterer Parameter näher beschreiben. Welche Kindelemente jeweils erlaubt bzw. erforderlich sind hängt vom gewählten Algorithmus ab der über das <keyword>Algorithm</keyword> Attribut bestimmt wird.</p>		<p>Das <keyword>Algorithm</keyword> Attribut der <strong>EncryptionMethod</strong> kann u.a. die in der folgenden Tabelle aufgeführten URIs annehmen.</p>		<table>			<head>				<data>Name</data>				<data>URI</data>				<data>Implementierung</data>			</head>			<row>				<data>					<strong>AES 128</strong>				</data>				<data>http://www.w3.org/2001/04/xmlenc#aes128-cbc</data>				<data>erforderlich</data>			</row>			<row>				<data>					<strong>AES 192</strong>				</data>				<data>http://www.w3.org/2001/04/xmlenc#aes192-cbc</data>				<data>optional</data>			</row>			<row>				<data>					<strong>AES 256</strong>				</data>				<data>http://www.w3.org/2001/04/xmlenc#aes256-cbc</data>				<data>erforderlich</data>			</row>			<row>				<data>					<strong>TRIPLEDES</strong>				</data>				<data>http://www.w3.org/2001/04/xmlenc#tripledes-cbc</data>				<data>erforderlich</data>			</row>		</table>		<p>Zum Kodieren von geheimen Schlüsseln dienen die symmetrischen Algorithmen mit dem Zusatz <keyword>Key Wrap</keyword> in der folgenden Tabelle. <strong>EncryptionMethod</strong> muss dazu ein Kindelement von <link id="encryption_syntax_keyinfo.html#EncryptedKey">EncryptedKey</link> sein.</p>		<table>			<head>				<data>Name</data>				<data>URI</data>				<data>Implementierung</data>			</head>			<row>				<data>					<strong>AES-128 Key Wrap</strong>				</data>				<data>http://www.w3.org/2001/04/xmlenc#kw-aes128</data>				<data>erforderlich</data>			</row>			<row>				<data>					<strong>AES-192 Key Wrap</strong>				</data>				<data>http://www.w3.org/2001/04/xmlenc#kw-aes192</data>				<data>optional</data>			</row>			<row>				<data>					<strong>AES-256 Key Wrap</strong>				</data>				<data>http://www.w3.org/2001/04/xmlenc#kw-aes256</data>				<data>erforderlich</data>			</row>			<row>				<data>					<strong>TRIPLEDES Key Wrap</strong>				</data>				<data>http://www.w3.org/2001/04/xmlenc#kw-tripledes</data>				<data>erforderlich</data>			</row>		</table>		<p>Die RSA Algorithmen <keyword>RSA-v1.5</keyword> und <keyword>RSA-OAEP</keyword> sind asymmetrische Algorithmen zum sicheren Schlüsseltransport. Diese Algorithmen können nur verwendet werden, wenn <strong>EncryptionMethod</strong> ein Kindelement von <link id="encryption_syntax_keyinfo.html#EncryptedKey">EncryptedKey</link> ist.</p>		<table>			<head>				<data>Name</data>				<data>URI</data>				<data>Implementierung</data>			</head>			<row>				<data>					<strong>RSA-v1.5</strong>				</data>				<data>http://www.w3.org/2001/04/xmlenc#rsa-1\_5</data>				<data>erforderlich</data>			</row>			<row>				<data>					<strong>RSA-OAEP</strong>				</data>				<data>http://www.w3.org/2001/04/xmlenc#rsa-oaep-mgf1p</data>				<data>erforderlich</data>			</row>		</table>		<p>Prinzipiell können beliebige weitere Algorithmen verwendet werden. Dies ist von der konkreten Implementierung abhängig. Die Empfehlung des W3C lässt dabei offen, ob symmetrische oder asymmetrische Algorithmen verwendet werden.</p>	</text></chapter>