<?xml version="1.0" encoding="UTF-8"?><?xml-stylesheet type="text/xsl" href="../../resources/stylesheet.xsl"?><chapter category="basics" xmlns="http://www.xml-sicherheit.de" xmlns:xsi="http://www.w3.org/2001/XMLSchema-instance" xml:id="signatures_syntax_signature" xml:lang="de" xsi:schemaLocation="http://www.xml-sicherheit.de ../../resources/documentation.xsd">	<title>Das Signature Element</title>	<text>		<p>Das Wurzelelement einer digitalen Signatur mit XML wird durch das Element <strong>Signature</strong> dargestellt.</p>		<p>			<strong>Signature</strong> besitzt ein optionales Attribut <keyword>Id</keyword> vom Typ ID zur Identifikation der Signatur. Dieses Attribut ermöglicht die Identifikation einer bestimmten Signatur, falls ein XML-Dokument mehrere Signaturen enthält. Des Weiteren deklariert das Element den Namensraum (<keyword>namespace</keyword>) der Signatur mit dem Attribut <keyword>xmlns</keyword>. Das Namensraum Attribut kennzeichnet gleichzeitig auch die Version der XML-Signatur, eine Versionsangabe wie beispielsweise bei den XSL Transformations ist daher nicht notwendig. Derzeit gibt es für den Namensraum einen einzigen Wert: <keyword>http://www.w3.org/2000/09/xmldsig#</keyword> der an das Präfix <keyword>ds</keyword> gebunden wird. Neuere Versionen der Empfehlung werden einen anderen Namensraum verwenden.</p>		<p>			<strong>Signature</strong> besitzt vier Kindelemente, wovon die beiden Elemente <link id="signatures_syntax_signedinfo.html">SignedInfo</link> und <link id="signatures_syntax_signaturevalue.html">SignatureValue</link> Pflicht sind. Des Weiteren kann ein <link id="signatures_syntax_keyinfo.html">KeyInfo</link> Element angegeben werden sowie beliebig viele <link id="signatures_syntax_object.html">Object</link> Elemente (auch null). Im Minimalfall besteht die XML-Signatur somit nur aus den Elementen <link id="signatures_syntax_signedinfo.html">SignedInfo</link> und <link id="signatures_syntax_signaturevalue.html">SignatureValue</link>.</p>	</text></chapter>