<?xml version="1.0" encoding="UTF-8"?><?xml-stylesheet type="text/xsl" href="../../resources/stylesheet.xsl"?><chapter category="plugin" xmlns="http://www.xml-sicherheit.de" xmlns:xsi="http://www.w3.org/2001/XMLSchema-instance" xml:id="cheatsheets" xml:lang="de" xsi:schemaLocation="http://www.xml-sicherheit.de ../../resources/documentation.xsd">	<title>Cheat Sheets</title>	<text>		<p>Die <strong>Cheat Sheets</strong> sind deutsch- bzw. englischsprachige Tutorials (die angezeigte Sprache hängt von den Ländereinstellungen des Betriebssystems ab) speziell für Anfänger und sollen Ihnen den Einstieg in das XML-Security Plug-In und die XML-Sicherheit erleichtern. Mit den fünf verfügbaren Anleitungen werden Sie Schritt für Schritt durch die Generierung einer <link id="sign.html">digitalen Signatur</link>, die <link id="verify.html">Verifizierung</link> sowie <link id="encrypt.html">Ver-</link> und <link id="decrypt.html">Entschlüsselung</link> und die Verwendung der <link id="quick.html">Quick Functions</link> geführt.</p>		<p>Anzeigen können Sie die Cheat Sheets über den Menüpunkt <keyword>Cheat Sheets...</keyword> im Menü <keyword>Help</keyword>. Im sich öffnenden Fenster finden Sie eine Rubrik <keyword>XML Security</keyword> mit den fünf enthaltenen Cheat Sheets. Nach der Auswahl eines Tutorials und dem Klick auf <strong>OK</strong> wird die gewünschte Anleitung angezeigt und Sie können diese schrittweise durcharbeiten. Über die Hilfe-Icons neben jedem Eintrag gelangen Sie zu weiterführenden Informationen in der Online-Hilfe.</p>		<p>Einige Abschnitte besitzen Icons zum Starten einer Aktion. Beispielsweise können Sie sich in den Signatur- und Verschlüsselungs-Cheat Sheets ein Projekt und ein XML-Dokument zum Ausprobieren generieren lassen. Außerdem können Sie direkt von aus dem <keyword>Quick Functions</keyword> Cheat Sheet in die Preferences Ihres Workspace wechseln.</p>		<p>Selbstverständlich können Sie einzelne Schritte überspringen sofern Sie die darin enthaltenen Aktionen bereits durchgeführt haben (wenn Sie z.B. bereits ein XML-Dokument zum Sichern erstellt haben).</p>	</text></chapter>