<?xml version="1.0" encoding="UTF-8"?><?xml-stylesheet type="text/xsl" href="../../resources/stylesheet.xsl"?><chapter category="plugin" xmlns="http://www.xml-sicherheit.de" xmlns:xsi="http://www.w3.org/2001/XMLSchema-instance" xml:id="sign_page_open_certificate" xml:lang="de" xsi:schemaLocation="http://www.xml-sicherheit.de ../../resources/documentation.xsd">	<title>Open an existing Key</title>	<text>		<p>Auf dieser zweiten Seite des <keyword>Digital Signature Wizard</keyword> müssen Sie zunächst den gewünschten Keystore und ein darin enthaltenes Zertifikat auswählen sowie die zugehörigen Passwörter angeben.</p>		<image id="../images/dsig-2a.png" title="Open an existing Certificate" width="275" height="392"/>		<p>Zunächst müssen Sie eine Java Keystore Datei (mit der Dateiendung <keyword>.jks</keyword>) auswählen. Über den Button <strong>Open...</strong> öffnen Sie das Standarddialogfeld zur Auswahl einer solchen Datei.</p>		<p>Anschließend sind weitere Angaben zum Keystore und Zertifikat erforderlich. Alle angegebenen Felder sind Pflichtfelder. Mit den <strong>Punkt</strong> Buttons rechts neben den Passwortfeldern können sie den Klartext in einem Passwortfeld anzeigen lassen und Ihre Eingabe kontrollieren.</p>		<p>Mit dem <keyword>Keystore Password</keyword> kann der Keystore selbst geöffnet werden. Anschließend legen Sie mit dem <keyword>Certificate Alias</keyword> fest, welches Zertifikat aus dem Keystore geladen werden soll. Dieses Zertifikat wird zur Erzeugung des <link id="../basics/signatures_syntax_keyinfo.html">KeyInfo</link> Elements und später zur <link id="verify.html">Verification</link> der Signatur benötigt. Eine Signatur lässt sich zwar auch ohne Angabe des <keyword>Certificate Alias</keyword> erzeugen, kann dann aber nicht mit dem XML-Security Plug-In verifiziert werden. Die Angabe des Alias ist daher ebenfalls erforderlich. Zum Abschluss müssen Sie noch das Passwort des Zertifikats angeben.</p>		<p>Nach der korrekten Eingabe aller erforderlichen Daten können Sie mit dem <strong>Next</strong> Button auf die nächste Seite des Digital Signature Wizards wechseln: <link id="sign_page_algorithms.html">Algorithms and Signature Properties</link>.</p>	</text></chapter>