<?xml version="1.0" encoding="UTF-8"?><?xml-stylesheet type="text/xsl" href="../../resources/stylesheet.xsl"?><chapter category="basics" xmlns="http://www.xml-sicherheit.de" xmlns:xsi="http://www.w3.org/2001/XMLSchema-instance" xml:id="signatures_canon_transform" xml:lang="de" xsi:schemaLocation="http://www.xml-sicherheit.de ../../resources/documentation.xsd">	<title>Kanonisierung und Transformation</title>	<text>		<p>Zwei Begriffen kommen bei der digitalen Signatur mit XML eine große Bedeutung zu: Kanonisierung (<keyword>canonicalization</keyword>, auch <keyword>C14N</keyword>) und Transformation (<keyword>transformation</keyword>). C14N übrigens deshalb, weil zwischen dem ersten Buchstaben C und dem letzten n von Canonicalization genau 14 weitere Buchstaben stehen.</p>		<p>Bei der <link id="signatures_canon.html">Kanonisierung</link> eines XML-Dokuments wird dieses in einheitlicher Form in einen Bytestrom überführt. Kanonisierung steht somit für die Normalisierung von XML-Dokumenten, um robuste und sichere Signaturen zu ermöglichen. Neben dem Einsatz in digitalen Signaturen ist die Kanonisierung beispielsweise auch wichtig bei der XML-basierten Versionskontrolle (d.h. beim <keyword>diff</keyword>).</p>		<p>Mit <link id="signatures_transform.html">Transformationen</link> beschreibt XML die Umwandlung von referenzierten Daten vor der Signierung auf verschiedenste Art und Weise.</p>	</text></chapter>