<?xml version="1.0" encoding="UTF-8"?><?xml-stylesheet type="text/xsl" href="../../resources/stylesheet.xsl"?><chapter category="plugin" xmlns="http://www.xml-sicherheit.de" xmlns:xsi="http://www.w3.org/2001/XMLSchema-instance" xml:id="decrypt" xml:lang="de" xsi:schemaLocation="http://www.xml-sicherheit.de ../../resources/documentation.xsd">	<title>Decryption Wizard</title>	<text>		<p>Mit dem <keyword>Decryption Wizard</keyword> können Sie auf komfortable und einfache Weise Ihre verschlüsselten XML-Dokumente wieder entschlüsseln und den Klartext wiederherstellen. Hierfür benötigen Sie die bei der <link id="encrypt.html">Verschlüsselung</link> gespeicherte Datei mit dem Schlüssel und den für diese Datei gewählten Verschlüsselungsalgorithmus.</p>		<p>Der <keyword>Decryption Wizard</keyword> wird über den Eintrag <strong>New Decryption...</strong> im Kontextmenü aufgerufen. Er besteht aus einer einzigen Seite <link id="decrypt_page_decryption.html">Decryption</link>. Über das Hilfe-Icon links unten auf jeder Seite erhalten Sie eine kontextabhängige Kurzhilfe und können weitergehende Informationen abrufen.</p>	</text></chapter>