<?xml version="1.0" encoding="UTF-8"?><?xml-stylesheet type="text/xsl" href="../../resources/stylesheet.xsl"?><chapter category="basics" xmlns="http://www.xml-sicherheit.de" xmlns:xsi="http://www.w3.org/2001/XMLSchema-instance" xml:id="signatures_transform" xml:lang="de" xsi:schemaLocation="http://www.xml-sicherheit.de ../../resources/documentation.xsd">	<title>Transformation</title>	<text>		<p>Mittels Transformationen können die durch das URI Attribut adressierten Daten vor der Hashwertberechnung umgewandelt und gezielt Dokumentfragmente zum Signieren ausgewählt werden.</p>		<p>			<strong>Base64</strong> wandelt Base-64 Zeichenketten zurück in die entsprechenden Oktette. Base-64 ist ein von der IETF spezifiziertes Kodierungsverfahren für Binärdaten und ermöglicht die Einbettung beliebiger Daten in das XML-Dokument. Der Name Base-64 kommt daher, dass zur Kodierung von Daten aller Art nur die 64 Zeichen <keyword>a-z, A-Z, 0-9,+,/</keyword> verwendet werden. Binäre Zeichen könnten sonst nicht in XML dargestellt werden. Die so eingebetteten Binärdaten werden im Base-64 encoding dadurch allerdings um 33% größer als die Ursprungsdaten im Binärformat.</p>		<p>Die <strong>Enveloped Signature Transform</strong> verhindert, dass Signaturen sich selbst signieren, indem vor dem Signieren alle zur Signatur gehörenden Elemente durch die Transformation entfernt werden.</p>		<p>Das <strong>XPath Filtering</strong> verarbeitet XPath-Knoten. Mit diesen Transformationen können Knoten aus einer XML-Knotenmenge ausgewählt werden, die beim Signieren berücksichtigt werden sollen. Der Rest des Dokuments wird nicht in die Signatur miteinbezogen. Wird XPath als Transformation einer XML-Signatur verwendet, wird es als Filtermechanismus angewandt und nicht als Auswahlmechanismus. Der XPath Filter 2.0 besitzt die gleichen Funktionen wie die ursprünglichen XPath Transformationen, arbeitet aber sehr viel effizienter und besitzt eine einfachere Syntax.</p>		<p>Eine <strong>XSLT Transform</strong> transformiert die zu signierenden Daten mit den Extensible Stylesheet Language Transformations (XSLT). Mit XSLT können die XML-Daten beispielsweise vor dem Signieren in die HyperText Markup Language (HTML) umgewandelt werden.</p>		<p>Möglich sind die in der folgenden Tabelle aufgeführten Transformationen. Zusätzlich zu den hier aufgeführten Algorithmen gehören auch die bereits bei der <link id="signatures_canon.html">Kanonisierung</link> genannten Algorithmen zu den Transformationen.</p>		<table>			<head>				<data>Name</data>				<data>URI</data>				<data>Implementierung</data>			</head>			<row>				<data>					<strong>Base64</strong>				</data>				<data>http://www.w3.org/2000/09/xmldsig#base64</data>				<data>erforderlich</data>			</row>			<row>				<data>					<strong>Enveloped Signature Transform</strong>				</data>				<data>http://www.w3.org/2000/09/xmldsig#enveloped-signature</data>				<data>erforderlich</data>			</row>			<row>				<data>					<strong>XPath Filtering</strong>				</data>				<data>http://www.w3.org/TR/1999/REC-xpath-19991116</data>				<data>empfohlen</data>			</row>			<row>				<data>					<strong>XSLT Transform</strong>				</data>				<data>http://www.w3.org/TR/1999/REC-xslt-19991116</data>				<data>optional</data>			</row>		</table>	</text></chapter>