<?xml version="1.0" encoding="UTF-8"?><?xml-stylesheet type="text/xsl" href="../../resources/stylesheet.xsl"?><chapter category="basics" xmlns="http://www.xml-sicherheit.de" xmlns:xsi="http://www.w3.org/2001/XMLSchema-instance" xml:id="signatures_detached" xml:lang="de" xsi:schemaLocation="http://www.xml-sicherheit.de ../../resources/documentation.xsd">	<title>Detached Signature</title>	<text>		<p>Bei einer <strong>detached signature</strong> gibt es keine Eltern-Kind-Beziehung zwischen Signatur und Dokument. Das Originaldokument ist vielmehr eine separate Ressource. Das zu signierende Dokument wird bei einer <strong>detached signature</strong> nicht verÃ¤ndert. Der signierte Inhalt kann sich im selben Dokument wie die Signatur oder in einem anderen Dokument befinden.</p>		<image id="../images/signatures_detached.png" title="Detached Signature" width="425" height="284"/>		<p>Der XML-Baum hat damit den folgenden Aufbau:</p>		<code>&lt;Signature&gt;&lt;/Signature&gt;&lt;DocumentData&gt;&lt;/DocumentData&gt;</code>	</text></chapter>